{
  "id": "N03",
  "titulo": "Morador anda pela sala por 10 minutos",
  "tipo": "NORMAL",
  "modo": "IDEAL",
  "duracao_ms": 720000,
  "descricao": "Ocupação contínua com movimento.",
  "comportamento_ideal": "Luz acesa sem interrupção.",
  "comportamento_referencia": "Nenhum apagamento indevido.",
  "estado_inicial": {
    "ocupantes_na_sala": [],
    "luz": "APAGADA"
  },
  "acoes": [
    {
      "t_ms": 5000,
      "ocupante": "morador",
      "acao": "ENTRAR"
    },
    {
      "t_ms": 10000,
      "ocupante": "morador",
      "acao": "ANDAR_ALEATORIO",
      "duracao_ms": 600000
    },
    {
      "t_ms": 625000,
      "ocupante": "morador",
      "acao": "ANDAR",
      "ate": [
        0.95,
        0.4
      ]
    },
    {
      "t_ms": 630000,
      "ocupante": "morador",
      "acao": "SAIR"
    }
  ],
  "falhas": [],
  "requisitos": [
    "RF-OPR-01"
  ],
  "regras": [
    "RN-I0-02",
    "RN-I0-03"
  ]
}