{
  "id": "M07",
  "versao": "v1dt",
  "ambiente": "residencia-v1",
  "titulo": "O SA do vão falha",
  "tipo": "FALHA",
  "modo": "IDEAL",
  "duracao_ms": 240000,
  "descricao": "O SA-02 perde a próxima passagem. O morador passa para a cozinha em t=40 s.",
  "comportamento_ideal": "A cozinha acende mesmo assim, um pouco depois, pelo PIR.",
  "comportamento_referencia": "Sem o SA, o SP-02 detecta o movimento e acende a cozinha.",
  "estado_inicial": {
    "ocupantes_na_sala": [],
    "luz": "APAGADA"
  },
  "acoes": [
    {
      "t_ms": 5000,
      "ocupante": "morador",
      "acao": "ENTRAR"
    },
    {
      "t_ms": 10000,
      "ocupante": "morador",
      "acao": "ANDAR_ALEATORIO",
      "duracao_ms": 25000
    },
    {
      "t_ms": 40000,
      "ocupante": "morador",
      "acao": "MUDAR_COMODO",
      "para": "cozinha"
    },
    {
      "t_ms": 45000,
      "ocupante": "morador",
      "acao": "ANDAR_ALEATORIO",
      "duracao_ms": 190000
    }
  ],
  "falhas": [
    {
      "t_ms": 0,
      "tipo": "SA_PERDE_PROXIMA",
      "dispositivo": "SA-02"
    }
  ],
  "requisitos": [
    "RN01",
    "RF-OPR-01"
  ],
  "regras": [
    "RN-V1-01"
  ]
}
